"1041388","李克强总理在9月6日的国务院常务会议上强调，“打造大众创业、万众创新升级版，不仅要巩固近年来快速发展的新业态、新模式，还要向更广阔的领域拓展，使创业创新在更大范围、更高层次和更深程度上蔚然成风。”李克强指出，要继续发挥“双创”在扩大就业、促进创新方面所起到的重要作用，同时在原有基础上进一步升级。打造“双创”升级版，要突出重点拓展两大空间：一是工业互联网，二是“互联网＋公共服务”。（中国政府网）","2018-09-09 14:04:35","2018-09-09 14:09:24","['其他', '焦点']"
"1041389","丰山集团中签结果出炉，中签号码共有20000个，每个中签号码只能认购1000股。","2018-09-09 14:09:58","2018-09-09 14:10:04","['公司']"
"1041390","今年以来，美国通过强化政策支持、推动国会立法、加大研发投入等多项措施，优先推进人工智能技术发展，力图保持人工智能时代“领头羊”地位。除对内构建人工智能体系外，美国政府对外还采取积极策略，对各国的人工智能发展进行跟踪与评估，并通过各种手段遏制竞争对手的发展。（新华社）","2018-09-09 14:22:29","2018-09-09 14:22:36","['行业', '其他']"
"1041391","郑商所副总经理王晓明在2018第三届中国（郑州）国际期货论坛的“期权分论坛”上表示，近期工作重点为扎实做好棉花期权上市各项准备，待上市申请获批后，确保棉花期权顺利挂牌。在未来几年，按照“农产品-工业品-指数及其他新兴领域”的路径，实现主要品种的配套期权上市，研究开发价差期权、系列期权、商品指数期权等新型衍生品。（期货日报网）","2018-09-09 14:33:15","2018-09-09 14:33:25","['市场']"
"1041392","中国首届新能源汽车产业峰会于9月9日在山东德州齐河县开幕。中国汽车流通协会常务理事贾新光在会上表示，面对特斯拉入华、国外电池技术日趋成熟，留给中国新能源车企的时间已经不多，窗口期只有3-5年。当前，应当抓紧电池技术的研究。","2018-09-09 14:37:22","2018-09-09 14:37:30","['行业']"
"1041393","据央视网：朝鲜阅兵后的群众游行，主要展示的内容也是关于朝鲜的经济、民生方面的变化。对外传递的姿态并不是强硬，更多的是在展示经济和民生方面的改善这方面的成就。","2018-09-09 14:47:32","2018-09-09 14:47:32","['其他']"
"1041394"," 海航集团旗下一家从事信息技术的公司HNA Ecotech出售的1.056亿美元债 券的赎回时间将再推迟八周。 该公司周六在新加坡证券交易所发布的文件显示，该债券将于11月6日以本金金额的 104%进行赎回，而不是此前7月份宣布的9月11日。 该公司可能会选择在2021年4月到期前赎回该债券，不过公司自去年11月以来已经几次推迟提前赎回计划。","2018-09-09 14:53:39","2018-09-09 14:53:39","['公司']"
"1041395","日本确认自1992年以来首席爆发猪瘟。","2018-09-09 15:06:36","2018-09-09 15:06:36","['其他']"
"1041396","万盛股份(603010)9月9日晚间公告，公司与林越飞、李芳、李宇崇、项雪松、秦良于9月9日签署《合资协议》，拟在苏州共同投资设立高盛通微电子（苏州）有限公司。新公司司注册资本为3500万元，万盛股份拟出资2065万元，持有新公司59%的股权。","2018-09-09 15:16:19","2018-09-09 15:16:19","['公司']"
"1041397","康欣新材披露第一期员工持股计划草案，该员工持股计划拟筹集资金总额不超过5000万元。资金来源为员工的合法薪酬和通过法律、行政法规允许的其他方式取得的自筹资金。该员工持股计划设立后，将委托信托公司设立金额上限为1亿元的集合资金信托计划，通过二级市场完成标的股票的购买。","2018-09-09 15:36:09","2018-09-09 15:36:09","['公司']"
"1041398","海通证券姜超研究团队认为，受通胀预期、供给放量和美国加息影响，债市短期受到冲击。但从经济基本面看，目前无论是需求还是生产都明显回落，而通胀也是短升长降，债市长期依旧向好，调整就是配置机会。政府债券发行放量短期弥补了社会融资的回落，但社会融资当中收缩的主要是影子银行，而新增的融资主要流向了政府部门，依赖于影子银行融资的房地产、融资平台等机构仍面临债务违约风险冲击，未来仍需以中高等级债券为主展开配置。","2018-09-09 15:43:59","2018-09-09 15:44:07","['观点']"
"1041399","资金流向监测机构EPFR数据显示，截至5日的当周，离岸中国股票基金连续第六周吸引到资金净流入。以单周为计算单位，在过去36周内此类基金已经第30次吸引到资金净流入，其涵盖QFII以及那些投资海外上市中国股票的基金。而中国债券基金自二季度以来第19次吸引到资金净流入。总体来看，在上述统计期内，EPFR追踪的全球所有股票基金遭遇1.51亿美元资金赎回，债券基金流出19亿美元，货币市场吸引到超过230亿美元资金净流入。","2018-09-09 15:51:55","2018-09-09 15:52:01","['市场']"
"1041400","天房发展9月9日晚间公告，公司董事会近日收到公司董事长熊光宇和董事、总经理毛铁的辞职报告。熊光宇因工作变动原因，辞去公司第九届董事会董事长、董事和董事会各专业委员会委员职务。毛铁因工作变动原因，辞去公司第九届董事会董事、董事会各专业委员会委员和公司总经理职务。","2018-09-09 15:53:57","2018-09-09 15:54:03","['公司', 'A股']"
"1041402","郑商所非农产品部相关人员在9日郑州举办的“2018第三届中国（郑州）国际期货论坛--PTA分论坛”上表示，PTA期货引入境外投资者，境内外客户均需满足“四有两无”的标准。其中，要具备期货基础知识，了解交易所特定品种相关业务规则，通过相关测试；其可用资金余额均不低于人民币10万元或等值外币，最近三年内具有境内或境外期货交易成交记录。合规诚信：开户机构应对交易者的诚信状况进行综合评估，可要求交易者出具相关书面承诺。“单位交易者要具有参与期货交易的内部控制、风险管理等相关制度；具有健全的信息通报制度。境外自然人和单位客户均可以参与。”交易所相关人员介绍说。","2018-09-09 16:00:06","2018-09-09 16:00:12","['宏观']"
"1041403","英国总工会总秘书称，若英国首相特雷莎·梅未能达成有助于工人的脱欧协定，总工会将会支持第二次脱欧公投。","2018-09-09 16:03:03","2018-09-09 16:03:03","['宏观']"
"1041404","在一些投资领域，证券公司、基金管理公司也开始尝试研发针对金融投资的人工智能系统，培训智能机器。通过分析大量的股票交易数据，让机器帮助人选择更优的投资股票。周健男称，现阶段，招商银行、光大都已经有了这方面的尝试。","2018-09-09 16:09:55","2018-09-09 16:10:01","['市场']"
"1041405","冀东水泥晚间公告，公司间接控股股东金隅集团拟向公司全体股东（除金隅集团、冀东发展集团有限责任公司外）发起部分要约，预定收购的股份数量为6737.61万股，占公司总股本的5%。要约价格为11.68元/股，较公司最新股价9.87元溢价了18.34%。本次要约收购所需最高资金总额为7.87亿元。公司股票将于9月10日复牌。","2018-09-09 16:12:19","2018-09-09 16:12:31","['公司', '焦点', 'A股']"
"1041406","金盾股份9月9日晚间公告，公司股票已连续5个交易日涨停，涨幅偏离值累计达到60.97%。公司不存在应披露而未披露的重大事项，也不存在处于筹划阶段的重大事项。截止目前，绍兴市公安局上虞区分局经济犯罪侦查大队立案侦查的公司印章被伪造案、浙江金盾消防器材有限公司涉嫌集资诈骗案、浙江金盾控股集团有限公司投融资部负责人张汛涉嫌非法吸收公众存款案仍在侦查过程中，目前尚无明确结论。","2018-09-09 16:13:07","2018-09-09 16:13:07","['公司', 'A股']"
"1041407","方大集团9月9日晚间公告，近日，全资子公司深圳市方大建科集团有限公司中标深圳市腾讯数码大厦幕墙工程项目，项目金额3.14亿元，是公司2017年度幕墙系统及材料产业收入的19.01%。","2018-09-09 16:16:41","2018-09-09 16:16:54","['公司', 'A股']"
"1041408","郑商所非农产品部副总监王宗芳表示，PTA期货引入境外交易者方案的总体思路是：在现有平台基础上合约标的、交易模式、交割制度和风控体系等不变，以人民币为基础计价和结算货币，外币仅用于充抵保证金，增加保税交割打通境内外物流通道，立足于境外交易者直接通过境内期货公司或通过境外期货经纪机构转委托境内期货公司的方式（二级代理）参与PTA期货交易。","2018-09-09 16:19:59","2018-09-09 16:19:59","['市场']"
"1041409","（在被问及英国脱欧协议是否会引发国内动荡）英国内政大臣Javid：每个政府部门都应该为所有可能发生的情况做好准备，但不要指望会达成协议。","2018-09-09 16:26:52","2018-09-09 16:26:52","['宏观']"
"1041441","中国证监会副主席方星海表示，今年以来，中国期货市场在对外开放方面呈现出品种、 机构、投资者“三箭齐发”的良好态势。下一步，中国证监会将按照国家金融业对外开放的总体部署，坚持“引进来、走出去”兼顾、 近期以“引进来”为主的方针，顺势而为，积极有序地推进中国期货市场的对外开放。","2018-09-09 18:23:20","2018-09-09 18:23:26","['市场']"
"1041442","至纯科技9月9日晚公告，拟以16.51元/股发行2616.52万股，并支付2.48亿元现金，合计作价6.8亿元收购波汇科技100%股权。公司同时拟募集不超4.3亿元配套资金。波汇科技产品线丰富，除在光纤传感领域拥有核心技术外，在模式识别和深度学习智能算法、智能视频、软件平台等方面也具有核心技术，2018年-2020年扣非后的净利润分别不低于3200万元、4600万元、6600万元。","2018-09-09 18:26:07","2018-09-09 18:26:15","['公司', 'A股']"
"1041451","伊拉克石油部长：伊拉克南部地区局势好转。并不担心国内的石油生产。目前伊拉克生产原油436万桶/日。伊拉克石油产能可达475万桶/日。伊拉克重启了Baiji地区Salahuddin-2炼油厂。Salahuddin-2炼油厂目前生产原油7万桶/日。","2018-09-09 18:41:53","2018-09-09 18:41:59","['宏观']"
"1041454","受国家宏观经济去杠杆、公司债券发行节奏放缓及第二季度公司债券到期兑付影响，中融新大触发投资者保护条款，其已将上述情况告知主承销商恒丰银行。根据募集说明书的约定，中融新大在上述触发投资者保护条款的情形发生后，拥有 10 个工作日的宽限期。若中融新大在该宽限期内恢复原状，则不构成发行人在本期债务融资工具项下的违反约定;若宽限期内无法恢复原状，主承销商将在触发情形发生之日起 20 个工作日内召开债务融资工具持有人会议，就募集说明中约定的救济与豁免方案的选择及实施进行表决。（新京报）","2018-09-09 19:07:26","2018-09-09 19:07:50","['公司', '焦点']"
"1041457","9月7日，国家药品监督管理局发布公告称，经吉林省药品检验所等6家药品检验机构检验，新华制药有限公司等10家企业生产的15批次药品不符合规定。","2018-09-09 19:11:45","2018-09-09 19:11:50","['公司']"
"1041463","今天《新闻联播》的主要内容有：1、习近平就朝鲜国庆70周年向朝鲜最高领导人金正恩致贺电。2、栗战书会见金正恩转交习近平总书记亲署函。3、学有所教，筑梦未来。4、以变应变，再闯新天地。5、税务机构改革提升服务管理水平，助力企业做强经济发展。6、北京互联网法院今天成立。7、我国西南最长高铁隧道正式开建。8、赤喀客专万吨级连续梁成功转体。9、非洲各界高度评价中非合作论坛北京峰会成果。10、朝鲜举行国庆70周年阅兵集会。11、胡塞武装缺席，也门和谈无果而终。12、巴勒斯坦谴责美切断对巴资金支持。","2018-09-09 19:32:21","2018-09-09 19:32:21","['宏观', '焦点']"
"1041465","意大利财长Tria：意大利政府的目标是GDP增长1.6%，意大利经济增长率暂时落后于欧元区（平均水平），意大利过去10年的经济政策未能（让意大利）缩小（同欧元区）经济增长率差距，意大利政府不会通过增加赤字来促进经济增长。因投资保持较低水平，意大利经济增长率有限。","2018-09-09 19:40:39","2018-09-09 19:52:19","['宏观']"
"1041466","云南锗业9月9日晚间公告，公司子公司云南鑫耀半导体材料有限公司、云南中科鑫圆晶体材料有限公司、云南东昌金属加工有限公司、昆明云锗高新技术有限公司2018年6月23日至2018年9月6日期间累计收到各类政府补助金额合计537.50万元。","2018-09-09 19:40:59","2018-09-09 19:41:05","['公司', 'A股']"
"1041468"," 据统计，23家有可比数据的上市券商中，有14家增员，9家减员。其中9家券商上半年合计减员2503人，14家券商增员1768人。减员人数较多的券商包括招商证券、中信建投证券、中信证券、银河证券和申万宏源证券，其中，招商证券减员725人，中信建投证券减员513人。（券商中国）","2018-09-09 19:51:24","2018-09-09 19:51:29","['行业']"
"1041472","来自中国卫星导航系统管理办公室的消息，今年底，北斗三号卫星在轨数量计划达到19颗，北斗工程全球组网进入关键期。中国卫星导航系统管理办公室主任冉承其表示：“计划到今年11月份可以完成19颗卫星的发射。通过这19颗卫星的组网，可以提供全球的基本服务。（目前）还剩下7颗，后续四次发射。”按照北斗工程“三步走”计划，我国将在2020年建成由30颗北斗卫星组成的全球导航定位系统。而今年发射19颗卫星任务的成功与否，对于后续全球组网计划至关重要。","2018-09-09 19:59:08","2018-09-09 19:59:12","['宏观']"
"1041473","巴西雷亚尔兑美元上涨1%。","2018-09-09 20:01:24","2018-09-09 20:01:32","['市场']"
"1041474","英国航空（British Airway）近日表示，公司订票系统曾遭黑客入侵，8月21日到9月5日期间客户订票信用卡信息及个人资料遭黑客攻击盗取，涉及约38万名客户，而且无论是通过网站还是手机App购买的客户，都没能幸免。","2018-09-09 20:01:42","2018-09-09 20:01:47","['宏观']"
"1041475","9月21日，乐视控股（贾跃亭旗下企业，乐视网股东之一）持有的乐融致新股权将正式司法拍卖。按照拍卖底价计算，乐融致新100%股权的估值只有18亿元左右，这远低于腾讯等机构的入股价。而在2017年初，乐融致新的估值最高达到了270亿。（每经）","2018-09-09 20:08:45","2018-09-09 20:08:53","['公司']"
"1041478","有接近监管机构的人士表示，对于已经立案调查的案件，基本都是“十拿九稳”。一家合资券商债券承销业务工作人员表示，德邦证券此次在该债券后续督导中没有及时向市场披露该企业涉及重大亏损、重大诉讼。债券承销业务是公司最为倚重的业务，此次被立案调查后公司将面临债券承销业务量锐减、员工离职、收入下滑等问题，至于多久能缓过来，要看它的业务发展进度。（第一财经）","2018-09-09 20:22:55","2018-09-09 20:23:03","['公司']"
"1041479","中国证券投资基金业协会已在新发布的《私募基金登记备案相关问题解答(十五)》中明确，9月10日起，有开展跨资产类别配置的投资业务需求的私募管理人登记申请即可通过系统报送申报材料。在私募资产配置管理人的发起和运营上，中基协均设定了较传统私募机构更高的登记准入标准，例如需要成为中基协普通会员或具有三年以上的产品运营年限及不少于5亿元的年均规模。不过，该规定亦被业内视为渠道机构向管理机构转型的“出口”，并有望成为不少银行、券商、第三方财富公司开展私募资产配置业务的载体。（经济观察报）","2018-09-09 20:23:40","2018-09-09 20:23:48","['行业']"
"1041480","冯小刚发微博称，“我没有所谓的阴阳合同，更没有偷逃税。”。他表示，其《美拉传媒》每年纳税几千万，纳过的个人所得税累计数亿，加上拍摄影片的总票房五十多亿，制片公司和院线所交纳十几亿税费。","2018-09-09 20:26:50","2018-09-09 20:27:36","['其他', '焦点']"
"1041481"," 第一，面向全社会减税减费，让企业有更多的钱可以投入研发，让消费者有更多的钱可以用于消费。第二，制定一套相对合理的规则，然后尽量做到不说变就变，给市场一个建立中长期预期的机会。如果能做到这两点，我相信中国经济还有很大的机会可以再有一个20年的黄金发展期。","2018-09-09 20:44:59","2018-09-09 20:45:05","['宏观', '观点']"
"1041482","华兴资本更新招股书，招股书显示，华兴资本2018年上半年，整体营业收入由2017年上半年的5420万美元增至1.08亿美元，同比增长达100%，而同期经营利润则达到2030万美元。","2018-09-09 20:54:07","2018-09-09 20:54:15","['公司']"
"1041483","日前，台湾被动元件龙头国巨向客户发送了有关「MLCC价格和交货周期调整」的通知函，大致意思是，MLCC仍存在需求过剩的情况，但公司却面临着原材料供应和环境等方面的挑战，所以决定继续对价格进行相应调整，并且超过1年交期的将停止接单。据摩根士丹利分析，包括电容器、电阻器、存储器和某些分立器件在内的许多元件交期目前仍在延长，这其中以MLCC缺货最为严重。","2018-09-09 20:56:39","2018-09-09 20:56:45","['行业']"
"1041484","海通证券数据显示，截至2018年3月A股外资持股12016.33亿元，占A股自由流通市值比例为5.39%，（其中R/QFII持股占3.6%，陆股通北上资金持股占1.8%），公募基金和保险在A股中投资总额约为1.9万亿、1.5万亿，占全部A股自由流通市值比重约8.4%、6.7%。海通估算，截止7月底，外资持有自由流通市值比例约6%。另据海外资产管理Robeco公司的数据，A股自由流通市值中外资占比在今年年初还只占2%。（中国基金报）","2018-09-09 20:59:26","2018-09-09 20:59:26","['市场', 'A股']"
"1041564","据韩媒报道，韩国央行考虑降低2018年GDP增长预测。","2018-09-10 08:21:43","2018-09-10 08:21:48","['央行']"
"1041565","周六海关数据显示，中国8月进口大豆915万吨，较7月增加14%，在对美国大豆加征关税后，中国继续从巴西购买大豆。中国是全球头号大豆进口国，上年同期的大豆进口量为844万吨。海关数据显示，今年1-8月，中国总计采购了6,200万吨大豆，同比下滑2.1%。分析师称，11月之前的未来数月中，每月进口量应会超过700万吨，但之后随着因巴西大豆季节接近尾声，供应可能会收紧。（路透）","2018-09-10 08:26:19","2018-09-10 08:26:27","['市场', '观点']"
"1041566","今年5、6月，国内电视面板价格持续下跌，已经接近2016年来的历史低点，直到7月才开始止跌回升。伴随着5、6月面板价格的下跌，京东方A今年的半年报业绩也不尽如人意，营业收入和净利润都出现不同程度的下滑。不仅如此，其市值在8个月的时间内蒸发了800多亿元，股价跌幅超过40%。对于业绩下滑，京东方A给出的解释是，面板市场整体增长低于预期，供过于求，市场价格一路下行。另一个值得关注的财务数据是，上半年京东方A归母净利润约29.75亿，其中非经常性损益约19.96亿元。而当期收到并计入当期损益的政府补助约20.52亿元，政府补助在非经常性损益中占比约102.81%，金额相当于归母净利润的68.97%。（投资者报）","2018-09-10 08:32:48","2018-09-10 08:32:57","['公司', 'A股']"
"1041567","中国外汇交易中心：9月7日CFETS人民币汇率指数为93.52，按周涨0.44。","2018-09-10 08:33:13","2018-09-10 08:33:20","['市场']"
"1041568","日前，中国石油集团公司董事长王宜林主持召开集团公司第二届董事会第二十五次会议。会议审议国内和海外有关项目等议案。王宜林强调，要积极稳妥推进川东北罗家寨气藏开发项目，确保气田安全有效开发。严格项目管理，降低操作成本，提高合同执行能力，加快推进气田开发建设，确保今冬明春天然气安全平稳供应。要加快启动加拿大LNG项目，努力提升产业链整体效益。","2018-09-10 08:33:30","2018-09-10 08:47:14","['公司', 'A股']"
"1041569","知情人士透露，苹果一直在与报纸进行谈判，希望能将他们的新闻内容添加到Texture上，已经开展接触的包括《纽约时报》、《华尔街日报》和《华盛顿邮报》。很多人认为苹果可能会推出一款集音乐、视频和新闻于一身的超级订阅服务。","2018-09-10 08:33:50","2018-09-10 08:33:56","['行业', '公司']"
"1041570","治理房地产市场乱象的行动仍在继续。近日，海南省住建厅联合8个部门，对投机炒房、黑中介等行为进行重点治理。今年6月28日，住建部等7部门联合发布通知，从2018年7月初至12月底期间，将在30个城市先行开展治理房地产市场乱象专项行动。截至9月9日，2个多月的时间内，至少有11省份、16城陆续响应，海南成为又一个加入的省份。（中新网）","2018-09-10 08:36:52","2018-09-10 08:37:01","['行业', 'A股']"
"1041571","国际能源署(IEA)署长法提赫·比罗尔日前在接受媒体采访时表示，新兴市场的危机可能会影响石油需求，但这不会是影响油市的一个主要因素。今年供需平衡可能会变得更加紧张，从而给价格带来上行压力。其指出，如果原油进一步上涨，对全球经济来说没有好处，主要产油国应该增产以防止油价上涨。（中证报）","2018-09-10 08:40:03","2018-09-10 08:40:11","['市场', '观点']"
"1041572","近来，各地纷纷出台新政，降低工商业用电负担。日前，江西省发改委印发《关于进一步降低一般工商业电价有关事项的通知》，降低江西电网一般工商业目录电价每千瓦时4.64分。与2017年相比，电价降价幅度达10.38%，可减少企业用电成本超18亿元。同时，黑龙江省宣布今年该省一般工商业销售电价降价幅度达10.2%，全年可为全省一般工商业用电户减轻电费负担13.56亿元。专家表示，工商业电价降低给企业带来了实实在在的好处。（经济日报）","2018-09-10 08:40:56","2018-09-10 08:41:00","['A股']"
"1041573","今年以来，官方八次提及房地产税法。苏宁金融研究院宏观经济研究中心主任黄志龙表示，房地产税法被列入第一类项目，意味着房地产税法、增值税法、消费税法等10部单行税法，作为五年税法立法工作的重中之重，是必须完成的立法任务。尽管房地产税法被列入第一类项目，但并不意味着只能在第五年完成立法，根据当前房地产调控和地方财税体制改革进度，在2020年提请审议的可能性比较大。（证券日报）","2018-09-10 08:42:19","2018-09-10 08:42:24","['行业', 'A股']"
"1041574","9月6日下午，广东省政府对外发布《广东省进一步扩大对外开放积极利用外资若干政策措施（修订版）》。新政提出，“在专用车制造，新能源汽车制造，船舶设计，干线、支线和通用飞机设计、制造与维修等领域，可以设立外商独资企业”，“取消在广东设立的中资银行和金融资产管理公司的外资持股比例限制，支持外国银行在广东同时设立分行和子行”。（21）","2018-09-10 08:42:50","2018-09-10 08:43:01","['其他', 'A股']"
"1041575","融360监测数据显示，2018年8月份，全国首套房贷款平均利率为5.69%，相当于基准利率的1.161倍，环比上升0.35%，同比去年8月份5.12%的利率上升11.13%，这也是2017年1月份以来连续20个月上涨。（证券日报）","2018-09-10 08:45:56","2018-09-10 08:46:03","['A股']"
"1041576","截至09月09日，上交所融资余额报5111.38亿元，较前一交易日减少21.19亿元；深交所融资余额报3348.65亿元，较前一交易日减少11.89亿元；两市合计8460.03亿元，较前一交易日减少33.08亿元。","2018-09-10 08:46:07","2018-09-10 08:46:13","['A股']"
