"1035711","中国银河面临前经纪人提起的民事诉讼。","2018-08-29 17:32:11","2018-08-29 17:32:23","['公司', 'A股']"
"1035712","日海智能8月29日晚公告，公司全资子公司日海物联的控股子公司龙尚科技与北京咕咚体育有限公司签订《“咕咚”品牌运动手表战略合作协议》，在运动手表领域展开全面合作。据协议，龙尚科技为咕咚体育定制开发和生产制造“咕咚”品牌运动手表；2019年12月31日前，咕咚体育向龙尚科技采购总金额不低于1.5亿元的“咕咚”品牌运动手表。","2018-08-29 17:32:34","2018-08-29 17:32:39","['公司', 'A股']"
"1035713","人福医药披露半年报。2018年1-6月公司实现营业收入88.38亿元，较上年同期增长28.80%；实现归属于上市公司股东的净利润5亿元，较上年同期增长33.51%。","2018-08-29 17:34:18","2018-08-29 17:34:24","['公司', 'A股']"
"1035714","离岸人民币跌幅扩大至0.41%，报1美元兑6.8288元。","2018-08-29 17:35:16","2018-08-29 17:35:28","['市场']"
"1035715","商务部消息，当地时间8月27日，美国商务部公布对华铸铁污水管反倾销调查初裁结果。强制应诉企业山西恒通铸造有限公司以及中国其他生产商和出口商的倾销率均为302.61%。据美方统计，2017年我对美出口涉案产品约1150万美元。预计美国商务部将于2019年1月8日前作出倾销终裁。8月28日，美商务部公布对中国、印度及泰国甘氨酸反补贴调查初裁结果。中国两家强制应诉企业以及所有其他生产商和出口商的补贴率均为144.01%。2017年我对美出口金额约111万美元。预计美国商务部将于11月13日前后作出终裁。","2018-08-29 17:36:04","2018-08-29 17:36:04","['宏观']"
"1035716","穆迪授予中国奥园拟发票据B2评级。","2018-08-29 17:36:39","2018-08-29 17:36:46","['公司']"
"1035717","永东股份拟向不超10名特定对象非公开发行不超6,660万股股票，募集资金总额不超85,000万元，募资将用于年产4万吨煤系针状焦项目、年产5万吨洗油深加工项目、补充公司流动资金。公司2018年上半年实现营业收入12.60亿元，同比增长47.08%；实现归属于上市公司股东的净利润1.68亿元，同比增长76.20%。公司预计2018年1-9月净利润1.9亿元至2.5亿元，同比增长35.51%至78.30%。","2018-08-29 17:37:22","2018-08-29 17:37:34","['公司', 'A股']"
"1035718","自去年底QDLP重启后，多家机构已于今年陆续拿到第四批额度，其中包括摩根资产管理、联博投信等，且部分QDLP基金已经开始了募集。（第一财经）","2018-08-29 17:39:02","2018-08-29 17:39:08","['宏观', '行业', '焦点']"
"1035719","离岸人民币兑美元盘中跌至6.83关口，日内跌约290点。","2018-08-29 17:39:34","2018-08-29 17:39:41","['数据', '市场', '焦点']"
"1035720","好当家：控股股东拟6个月内增持不超过6000万元。","2018-08-29 17:39:52","2018-08-29 17:39:59","['公司', 'A股']"
"1035721","建设银行行副行长张立林在半年报业绩发布会上回应资管新规对商业银行的影响称，“理财收入下降是正常现象，商业银行应该去积极落实资管新规。”张立林表示，为了更平稳过渡，积极支持实体经济发展，资管业务总体暂时出现了业绩调整，对应的是整个资管的变化和要求，这是方向性的，暂时体现在收入的下降，但是对于建行来说不会体现衰退趋势。随着调整逐步到位，银行理财收入会逐步提升。资管也是建行未来很重要的发展方向。居民资产管理的总体需求并没有发生变化，在过渡期内银行理财收入将会出现缓慢上升，这也让银行有一定的缓冲，逐步消化那些不规范的理财业务，但这不影响继续服务实体经济。","2018-08-29 17:40:06","2018-08-29 17:40:12","['公司', '观点']"
"1035722","从市场获悉，茅台将再次出台“降温”稳市的新政策：经销商于今年12月底前可提前执行2019年1-2月计划。至此，联系近段时间陆陆续续出台的相关“降温”稳市的政策，茅台已经连续打出了五式“稳价组合拳”","2018-08-29 17:41:52","2018-08-29 17:41:52","['公司']"
"1035787"," 湖南省政府金融工作办公室答复政协提案的文件显示，正在推动出台促进资本市场发展的政策文件，将把引进沿海地区优秀产业转移企业，支持其发展、上市作为重要内容。支持拟上市企业做大做强，力争通过3-5年的努力，培育出一批符合湖南省产业发展战略的独角兽企业。","2018-08-29 19:21:23","2018-08-29 19:21:34","['宏观', '行业']"
"1035788","光线传媒半年报：实现营业收入7.2亿元，同比下降29.96%；实现净利润21.1亿元，同比增长426.05%。","2018-08-29 19:21:23","2018-08-29 19:21:34","['公司', 'A股']"
"1035789","视觉中国半年报：实现营业收入4.8亿元，同比增长25.84%；实现净利润1.38亿元，同比增长43.26%。","2018-08-29 19:23:10","2018-08-29 19:23:18","['公司', 'A股']"
"1035790","今日，农业农村部部长韩长赋主持召开农业农村部常务会议，会议审议并原则通过《关于支持长江经济带农业农村绿色发展的实施意见》。会议强调，重点做好长江经济带水生生物多样性保护、化肥农药减量增效、农业废弃物资源化利用、农村人居环境整治、乡村产业振兴等方面工作，加大倾斜支持力度，为长江经济带实现生态优先、绿色发展作出贡献。","2018-08-29 19:23:35","2018-08-29 19:29:20","['宏观']"
"1035791","楚江新材8月29日晚间回复交易所重组问询函并披露重组修订案，拟10.8亿元收购江苏天鸟90%的股权并募集配套资金，公司股票8月30日复牌。另外，公司拟变更募投项目“智能热工装备及特种复合材料产业化项目”的实施地点、实施方式及投资规模；对“年产1万吨高性能锂电池负极材料生产线建设项目”募投项目进行变更，将该项目募资余额2.67亿元用于“年产15万吨高端铜导体材料项目”。","2018-08-29 19:24:47","2018-08-29 19:24:58","['公司', 'A股']"
"1035792","欧元兑英镑扩大跌势日内下滑0.5%，至1欧元兑0.9042英镑，料录得逾两周最大跌幅。","2018-08-29 19:26:27","2018-08-29 19:26:37","['市场']"
"1035793","  记者获悉，8月29日，中国互联网金融协会在京举办了P2P网络借贷会员机构自查自纠专题培训班，指导和督促P2P网络借贷会员机构扎实开展自律检查自查自纠阶段有关工作。","2018-08-29 19:30:21","2018-08-29 19:30:28","['行业']"
"1035794","今天《新闻联播》的主要内容有：1、习近平给参加“一带一路”青年创意与遗产论坛的青年代表回信，勉励他们继续关注并积极参与“一带一路”建设，支持中非团结合作，为构建人类命运共同体作出努力。2、栗战书主持部分全国人大代表座谈会。3、韩正出席大气污染防治专题工作会议。4、前7个月全国社会物流总额同比增长6.9%。5、国家重点氢能源汽车产业项目在济南启动。","2018-08-29 19:31:40","2018-08-29 19:31:48","['宏观', '焦点']"
"1035795"," 中国宝安8月29日晚间披露半年报，上半年实现营业总收入43.64亿元，同比增长47.56%；实现营业利润3.42亿元，同比增长39.65%；净利润1.15亿元，同比增长43.49%。上半年，面对日益加剧的行业竞争压力，以及原材料、人工成本等不断上涨的经营压力，中国宝安整体收入、利润仍保持平稳增长。","2018-08-29 19:34:42","2018-08-29 19:34:56","['公司', 'A股']"
"1035796","  铜陵有色上半年营收407.21亿元人民币，同比增长6.27%，净利润4.12亿元人民币，同比增长74.41%。","2018-08-29 19:35:26","2018-08-29 19:35:33","['公司', 'A股']"
"1035797"," 8月29日，在广州港南沙港区粮食及通用码头筒仓二期工地，投资额合计近25亿元的广州南沙国际物流中心(北区)项目和广州港南沙粮食及通用码头筒仓二期同时动工。项目建成后，广州港南沙港区作为粤港澳大湾区物流分拨中心和粮食集散中心的核心枢纽地位将得到进一步巩固提升。（中国新闻网）","2018-08-29 19:36:12","2018-08-29 19:36:23","['行业']"
"1035798","鄂尔多斯半年报：实现营业收入104.5亿元，同比增长7.36%；实现净利润2.8亿元，同比增长65.22%。","2018-08-29 19:36:45","2018-08-29 19:36:52","['公司', 'A股']"
"1035799","亨通光电半年报：实现营业收入152.7亿元，同比增长33.81%；实现净利润11.7亿元，同比增长52.69%。","2018-08-29 19:37:01","2018-08-29 19:37:50","['公司', 'A股']"
"1035800","中债金融估值中心：今日利率债市场小幅波动。具体来看，SKY_3M稳定在2.15%；SKY_10Y稳定在3.61%。","2018-08-29 19:37:32","2018-08-29 19:37:40","['市场']"
"1035801","金证股份8月29日晚间公告，公司董事、总裁李结义应相关部门要求协助调查，暂时无法履职。目前，公司日常经营等工作由董事、高级副总裁徐岷波负责，公司经营一切正常。","2018-08-29 19:39:12","2018-08-29 19:39:40","['公司', 'A股']"
"1035802"," 有五家公司将在下个月通过上海国际能源交易中心进行原油交割，这是该合约首度有实货结算，而中国目前正期望该合约能与国际指标合约一争长短。五名熟知内情人士表示，包括国营的联合石化及振华石油在内，参与实货交割的业者将合计为上海国际能源交易中心9月原油期货合约交割60万桶中东原油。","2018-08-29 19:42:02","2018-08-29 19:42:08","['行业']"
"1035803"," 据天相顾数据统计，2018年上半年，基金公司管理费收入高达309亿元，而去年同期这一数据为262.87亿元，同比增幅高达17.63%。此外，在短短半年时间，管理费收入超过10亿元的就有8家基金公司。在所有的基金公司中，管理费收入水平最高的依旧是天弘基金，该公司上半年管理费收入高达28.46亿元，较去年同期增长了9.85亿元，增幅为52.89%。排名第二的为易方达基金，管理费收入为17.2亿元，较去年同期增长5.43亿元，增幅为46.15%。此外，还有工银瑞信基金、嘉实基金、华夏基金、汇添富基金、南方基金以及建信基金等多家公司上半年管理费收入超过10亿元。（上证）","2018-08-29 19:48:41","2018-08-29 19:48:52","['公司']"
"1035804"," 记者获悉，8月29日，广州市交通部门对市网约车市场整治情况进行通报，并表示对于网约车平台不配合调查的行为，将以“不配合出租汽车行政主管部门调取查阅相关数据信息”为由立案查处，对于不履行处罚决定的网约车平台将依法申请法院强制执行。目前，滴滴平台已有29宗违章案件，将到强制执行期。在滴滴顺风车下架期间，以滴滴顺风车名义变相从事旅客运输，将依法按非法营运处以3-10万元不等罚款。","2018-08-29 19:49:11","2018-08-29 19:49:20","['行业']"
"1035806","海通证券半年报：实现营业收入109.4亿元，同比下降14.58%；实现净利润30.3亿元，同比下降24.67%。","2018-08-29 19:51:15","2018-08-29 19:51:23","['公司', 'A股']"
"1035807","据已披露的半年报，养老金账户最新出现在银轮股份、大亚圣象、东尼电子、国药股份、伟星股份、蓝焰控股、石英股份、海轮钢琴、新疆众和、伟星新材、轻纺城、百联股份、天地科技、合盛硅业14只个股的前十大流通股东名单中，合计持股量0.93亿股。（数据宝）","2018-08-29 19:51:28","2018-08-29 19:51:53","['公司']"
"1035808","记者从长沙市交通行政执法局获悉，8月27日下午，该局约谈滴滴出行长沙分公司有关责任人，要求滴滴出行对其在长网络预约出租汽车业务和顺风车平台业务深入自查自纠，停止向不合规的网约车特别是外地牌照滴滴车辆及跨城际顺风车派单。","2018-08-29 19:54:00","2018-08-29 19:55:15","['行业', '焦点']"
"1035809","*ST信通8月29日晚间披露半年报，公司上半年实现营收4.87亿元，同比下滑28%；净利润亏损3.81亿元，上年同期为盈利2533万元。报告期内，公司收到新增4起诉讼，被诉讼原因与控股股东的债务纠纷相关，公司确认预计赔偿金2.32亿元，计入营业外支出，对利润产生重大影响。同时，受控股股东债务纠纷影响，公司主要资产及账户被冻结，业务受到较大影响。","2018-08-29 19:56:27","2018-08-29 19:56:40","['公司', 'A股']"
"1035810","波罗的海干散货指数下跌1.37%，报1661点。","2018-08-29 20:01:01","2018-08-29 20:01:08","['市场']"
"1035811","鄂尔多斯8月29日晚间公告，公司控股子公司电冶集团拟出资30.53亿元续建年产40万吨PVC、30万吨烧碱项目，以最终形成年产80万吨PVC、60万吨烧碱的产业规模。鄂尔多斯同时披露半年报，公司上半年实现营业收入104.49亿元，同比增7%；净利润2.79亿元，同比增长65%。","2018-08-29 20:01:09","2018-08-29 20:01:51","['公司', 'A股']"
"1035812","  记者29日从安徽合肥高新区举行的新闻发布会上获悉：该区日前出台了《加快推进世界一流高科技园区建设行动方案》。《方案》提出，到2020年，合肥高新区将建成国家科学中心核心区，实现GDP 900亿元。（中国新闻网）","2018-08-29 20:01:31","2018-08-29 20:01:38","['其他']"
"1035813","中国银保监会：金融业一些领域的风险隐患仍然突出。非法金融活动形势比较严峻。","2018-08-29 20:01:48","2018-08-29 20:01:54","['宏观', '行业']"
"1035814","银保监会召开银行保险监管工作电视电话会议，优化对重点领域的银行和保险服务，对关系国计民生的在建项目加强资金保障，防止因资金断供形成“半拉子”工程。","2018-08-29 20:02:30","2018-08-29 20:02:30","['宏观', '行业', '焦点']"
"1035815","总部位于上海的新开发银行29日宣布，标普全球评级将新开发银行主体长期信用评级定为“AA+”，短期评级为“A-1+”，展望稳定。","2018-08-29 20:04:56","2018-08-29 20:05:04","['公司']"
"1035816","波罗的海干散货指数下跌1.37%，报1661点。","2018-08-29 20:07:07","2018-08-29 20:07:13","['市场']"
"1035818","近日，上海市住建委、市房管局下发通知，要求各区对本市代理经租企业的经营模式、行为规范、融资业务等情况，开展集中专项检查，并对部分规模化企业集中抽查。今天，上海市住建委、市房管局会同相关部门和各区房管局，组建了四个检查组，分区域、分企业开展检查约谈。同时，上海市住建、房管、宣传、公安、工商、税务、物价、司法、银监等部门将联合行动，到今年年底，在全市范围内开展房地产市场专项整治。其中，对于炒作、操纵房租，捏造、散布不实信息，侵害承租人权益等行为作为整治重点，进一步整顿和规范市场秩序，健全房地产市场监管机制，切实维护人民群众合法权益。","2018-08-29 20:08:43","2018-08-29 20:08:53","['宏观', '行业']"
"1035819","印度卢比汇率跌至纪录新低，进口商的月末美元需求带来压力。","2018-08-29 20:09:36","2018-08-29 20:10:32","['市场']"
"1035820","  今日，中国银保监会召开银行保险监管工作电视电话会议，会议强调，深化银行业和保险业改革开放。继续深化公司治理改革，推动银行保险机构进一步强化党的领导和党的建设，加快探索完善有中国特色的现代金融企业制度。坚定不移推进对外开放，继续按照“宜早不宜迟，宜快不宜慢”原则，加快落实银行业和保险业扩大开放、大幅放宽市场准入的重要举措。积极做好共建“一带一路”金融服务，推动机构在有效防范各类风险的前提下，探索多样化可持续的融资方案。合理平衡好加快开放和防控风险的关系，指导银行保险机构不断加强风险管理。","2018-08-29 20:11:36","2018-08-29 20:11:36","['行业', '焦点']"
"1035821","工商银行获得奥地利监管机构许可，可在奥地利开展银行业务。","2018-08-29 20:14:34","2018-08-29 20:14:42","['公司']"
"1035822","亿帆医药半年报：实现营业收入23.25亿元，同比增长25.24%；实现净利润5.4亿元，同比增长12.2%；拟10派3元。","2018-08-29 20:15:33","2018-08-29 20:15:40","['公司', 'A股']"
"1035823","8月29日，中国银保监会召开银行保险监管工作电视电话会议，对近期重点工作任务提出要求。银保监会党委书记、主席郭树清出席会议并讲话。会议强调，以赴做好近期重点工作。一是继续做好防范化解金融风险各项工作；二是进一步增强实体经济服务质效；三是深化银行业和保险业改革开放；四是进一步加强系统内党的建设。","2018-08-29 20:16:59","2018-08-29 20:17:46","['行业']"
"1035824","29日，2018广州人工智能产业大会在广州举行。记者从大会获悉，截至2018年5月，广州市人工智能企业达到360家，资产总值达97.3亿元，2017年营收总额达625.8亿元。其中，在计算机视觉技术领域已具有较高水平，集中了大批的优秀创业公司。",,"2018-08-29 20:19:42","['行业']"
"1035825","海通证券8月29日晚间披露半年报，公司上半年实现营收109.42亿元，同比下滑15%；净利润30.31亿元，同比下滑25%；每股收益0.26元。报告期内，公司利息净收入24.2亿元，同比增长39%；投资收益及公允价值变动收益合计18.32亿元，同比减少60%。股东方面，中信证券新进公司前十大股东名单，持股比例2.15%。","2018-08-29 20:20:25","2018-08-29 20:20:51","['公司']"
"1035826","马钢股份上半年净利润34.3亿元人民币，同比增长108.62%。","2018-08-29 20:21:07","2018-08-29 20:21:15","['公司']"
"1035827","为加快推进贵州省充电基础设施建设，近日，贵州省召开2018年第二次充电基础设施建设厅际联席会议。会议指出，厅际联席会议各成员单位要高度重视电动汽车充电基础设施建设工作，确保完成年度目标任务。","2018-08-29 20:21:39","2018-08-29 20:21:49","['宏观']"
"1035828","江淮汽车(600418)8月29日晚间披露半年报，公司上半年实现营收237.09亿元，同比下滑6%；净利润1.63亿元，同比下滑53%；扣非后净利润亏损4.37亿元，上年同期盈利1.92亿元；每股收益0.09元。报告期内净利下滑主要系销量规模下降、融资成本上升、计提资产减值损失增加所致。","2018-08-29 20:22:51","2018-08-29 20:22:51","['公司', 'A股']"
"1035829","比亚迪半年报：实现营业收入541.5亿元，同比增长20.23%；实现净利润4.8亿元，同比下降72.19%；扣非后净亏损6.7亿元，上年同期扣非净利润11.15亿元。","2018-08-29 20:23:52","2018-08-29 20:24:23","['公司', '焦点']"
"1035830","深圳华强8月29日晚公告，公司控股子公司华强电商拟申请在新三板终止挂牌。华强电商上半年主动缩小业务规模、严控费用，在新三板终止挂牌，符合其目前实际经营情况，有助于降低运营成本。","2018-08-29 20:25:05","2018-08-29 20:25:58","['公司', 'A股']"
"1035831","今日晚间，豆萌科技有限公司向港交所递交招股书，独家保荐人为中信建投国际。豆盟科技是一家移动广告技术公司，艾瑞根据去年收益计算，其为中国第二大互动广告公司，市场份额12%。专有广告平台月活跃用户为1.55亿，互动广告累计访客4.41亿。2015——2017总营收为1.35亿元、2亿元、2.22亿元，复合年增长率为28.3%；净利润分别为2165.9万元、2483.2万元、3416.8万元。2018年第一季度营收7374.1万元，净利润1349.1万元。","2018-08-29 20:26:26","2018-08-29 20:26:26","['公司']"
"1035832","德国10年期国债收益率触及三周高点0.4%。","2018-08-29 20:27:42","2018-08-29 20:27:56","['宏观']"
"1035833","近日，上海市住建委、市房管局下发通知，要求各区对本市代理经租企业的经营模式、行为规范、融资业务等情况，开展集中专项检查，并对部分规模化企业集中抽查，督促维护好住房租赁市场秩序。29日，市住建委、市房管局会同相关部门和各区房管局，组建了四个检查组，分区域、分企业开展检查约谈。对检查中发现的违法违规问题，坚决予以查处。到今年底，将在全市范围内开展房地产市场专项整治。","2018-08-29 20:29:46","2018-08-29 20:32:38","['行业']"
"1035834","海航控股(600221)8月29日晚间披露半年报，公司上半年实现营收329.41亿元，同比增长15%；净利润5.48亿元，同比下滑52%；每股收益0.03元。","2018-08-29 20:29:47","2018-08-29 20:29:53","['A股']"
"1035835","美国二季度实际GDP年化季环比修正值 4.2%，预期 4%，初值 4.1%。美国二季度个人消费支出(PCE)年化季环比修正值 3.8%，预期 3.9%，初值 4%。美国二季度核心个人消费支出(PCE)物价指数年化季环比修正值 2%，预期 2%，初值 2%。美国二季度GDP平减指数年化季环比修正值 3，预期 3，初值 3。","2018-08-29 20:30:56","2018-08-29 20:32:42","['宏观', '焦点']"
"1035836","美国GDP数据过后，现货黄金短线小幅走低。","2018-08-29 20:31:20","2018-08-29 20:31:29","['市场']"
"1035837","加拿大二季度经常帐 -158.8亿加元，预期 -153亿加元，前值 -195亿加元修正为 -174.8亿加元。","2018-08-29 20:32:30","2018-08-29 20:32:39","['宏观', '焦点']"
"1035838","近日，上海市住建委、市房管局下发通知，要求各区对本市代理经租企业的经营模式、行为规范、融资业务等情况，开展集中专项检查，并对部分规模化企业集中抽查，督促维护好住房租赁市场秩序。29日，市住建委、市房管局会同相关部门和各区房管局，组建了四个检查组，分区域、分企业开展检查约谈。对检查中发现的违法违规问题，坚决予以查处。到今年底，将在全市范围内开展房地产市场专项整治。","2018-08-29 20:33:33","2018-08-29 20:33:45","['行业']"
"1035839","特朗普8月28日发推特称谷歌搜索“特朗普新闻”的显示结果全是来自假新闻，谷歌被操控了，显示的所有新闻都是负面的。特朗普还放话给科技巨头，并点名批评谷歌、推特和Facebook，警告他们“最好小心点”。","2018-08-29 20:33:33","2018-08-29 20:40:42","['宏观', '公司']"
"1035840","马钢股份半年报：实现营业收入400.6亿元，同比增长13.86%；实现净利润34.3亿元，同比增长108.62%。","2018-08-29 20:33:50","2018-08-29 20:33:57","['公司', 'A股']"
"1035841","阿根廷已要求IMF加快对其放款。","2018-08-29 20:34:23","2018-08-29 20:34:31","['宏观']"
"1035842","人民日报：根据草案，新个税法拟于2019年1月1日起全面施行；拟自2018年10月1日至12月31日，先将工资、薪金所得基本减除费用标准提高至5000元/月，并适用新的综合所得税率。","2018-08-29 20:34:54","2018-08-29 20:35:02","['宏观', '焦点']"
"1035843","柳工半年报：实现营业收入97.5亿元，同比增长65.55%；实现净利润5.86亿元，同比增长126.33%。","2018-08-29 20:35:59","2018-08-29 20:36:07","['公司']"
"1035846","暴风集团半年报：实现营业收入7.9亿元，同比下降4.21%；净亏损1.06亿元，上年同期盈利1572万元。 半年报：实现营业收入7.9亿元，同比下降4.21%；净亏损1.06亿元，上年同期盈利1572万元。","2018-08-29 20:36:42","2018-08-29 20:36:50","['公司', 'A股']"
"1035847","唐德影视发布2018年中报，上半年营业收入4.95亿元，同比增长59.03%，净利润9011万元，同比增长50.00%。唐德影视业绩增长主要来源于电视剧业务，该板块上半年实现收入4.55亿元，电视剧《战时我们正年少》、《东宫》等版权授权收入，以及《脱身》联合摄制分账收益等构成了收入的主要来源。","2018-08-29 20:36:59","2018-08-29 20:37:48","['公司', 'A股']"
"1035848","东风股份(601515)8月29日晚间披露半年报，公司上半年实现营收16.28亿元，同比增长11%；净利润3.58亿元，同比增长0.56%；每股收益0.32元。公司拟每10股派发股利2.3元（含税），共计派现2.56亿元。","2018-08-29 20:38:10","2018-08-29 20:38:21","['公司', 'A股']"
"1035849","自称“嘀嗒出行”顺风车司机边接单边在虎牙平台上直播，且专选女性乘客。对此，嘀嗒出行表示，经过查询，这两个车牌号都没有在嘀嗒平台注册过。（新京报）","2018-08-29 20:39:08","2018-08-29 20:39:15","['公司', '观点']"
"1035851","郑煤机披露半年报，报告期，公司实现营收12,720,498,610.35元，同比增长290.04%；归属于上市公司股东的净利润455,928,236.75元，同比增长179.66%，每股收益0.26元。","2018-08-29 20:39:59","2018-08-29 20:40:35","['公司']"
"1035852","ofo小黄车官方微博对部分区域用车受到影响做出说明称，今日18时，因服务器波动，导致部分区域用车受到影响，目前经过技术部门的快速抢修已经恢复正常，如有问题请拨打官方客服电话联系。","2018-08-29 20:40:02","2018-08-29 20:40:07","['公司']"
