"1038728","武汉市物联网“平安智慧小区”试点工作正加速推进，预计年内将有100个小区完成改造。同时，武汉市还将新增50万个公共安全视频监控，通过城市“天眼”监控网和小区物联网，织密扫黑除恶、打击犯罪的“天罗地网”。（新华社）","2018-09-04 17:39:48","2018-09-04 17:39:53","['宏观']"
"1038729","富瀚微：持股3.89%股东何辉拟6个月内减持不超过1.84%。","2018-09-04 17:41:19","2018-09-04 17:41:28","['公司', 'A股']"
"1038731","南非国债在第二季GDP数据公布后下跌，指标2026年到期国债收益率上涨11.5个基点至9.115%。","2018-09-04 17:42:22","2018-09-04 17:42:32","['宏观']"
"1038732","谷歌CEO透露，为加强在印度市场与Facebook的竞争，谷歌调整了印度发展策略，试图通过更好的广告工具和更多本地化服务吸引客户，目前已有成效，印度消费者在谷歌服务上花费的时间有所增加。据悉，2018年Facebook和谷歌分别在印度创收9.8亿美元、10亿美元。","2018-09-04 17:46:06","2018-09-04 17:46:06","['公司']"
"1038733","深圳将建机场东综合交通枢纽，在厦深铁路、深茂铁路的基础上，拟新增深圳至肇庆铁路、深圳至深汕特别合作区铁路，形成沿海时速350公里高速新通道。","2018-09-04 17:46:19","2018-09-04 17:46:31","['宏观']"
"1038734","日前，杭州市交通运管与市公安、交通治安、交警、车管等部门已组织在杭取得经营许可的14家网约车平台召开网络预约出租汽车规范管理工作会议。当日，参会的平台公司签署了《在杭经营网约车平台公司关于合法诚信经营、保障乘客安全的承诺书》，承诺从10月1日零时起，各平台停止向未取得网约车许可的车辆和人员派单。（新京报）","2018-09-04 17:49:12","2018-09-04 17:49:25","['行业']"
"1038735","时隔两年，新兴铸管驻疆钢铁企业再次易手。自工商资料获悉，新兴铸管新疆有限公司完成股权变动，公司股东从新兴际华集团有限公司变更为深圳九天清控投资合伙企业(有限合伙)。这意味着，原属上市公司新兴铸管旗下的新兴铸管新疆有限公司再次转手，新兴际华未能完全撤离。（新京报）","2018-09-04 17:50:00","2018-09-04 17:50:07","['公司', 'A股']"
"1038736","美团在最新招股书中称，公司称目前正在评估网约车可能给平台带来的协同价值，基于目前的市场情况，“预期不会进一步拓展此项目”。美团点评曾在2017年12月28日，在北京、上海、成都、杭州等7个城市同时上线美团点评打车入口，截至目前，真正落地服务的只有上海、南京两地。此前，美团点评已获得杭州、成都网约车牌照，却迟迟未落地业务，短时间内也将不再有大动作。","2018-09-04 17:53:02","2018-09-04 17:53:08","['公司', '焦点']"
"1038737","*ST双环公告，9月4日，公司与湖南盐业签署了意向协议，协议约定由湖南盐业收购公司持有的重庆宜化100%股权。2018年6月30日重庆宜化归属于母公司净资产-16,530.87万元，营业总收入66,393.99万元，归属于母公司所有者的净利润-9,274.78万元。","2018-09-04 17:54:09","2018-09-04 17:54:09","['公司', 'A股']"
"1038738","新华社发文称，从刚刚公布完毕的上市银行半年报可以看出，贷款投放加速，投向结构优化，银行业支持实体经济质效进一步提升，为经济迈向高质量发展提供有力支撑。工行上半年项目贷款新增2105亿元，占公司贷款增量的65%；截至6月末，农行重大项目库入库项目达到10782个，较上年末增加2359个，实现贷款投放2949亿元。建行在基础设施行业领域贷款余额近3.5万亿元，较上年末增加1333亿元。中行在“一带一路”沿线累计跟进重点项目超过600个，提供授信支持约1159亿美元。","2018-09-04 17:56:16","2018-09-04 17:56:24","['宏观']"
"1038739","峨眉山A：峨眉山风景区门票平均价格降幅约13.5%；参照2017年度游客人数计算，预计2018年公司门票收入减少约1000万元，2019年公司门票收入减少约5000万元。","2018-09-04 17:56:45","2018-09-04 17:56:51","['公司', 'A股']"
"1038740","美元/瑞郎攀升0.5%至0.9742，为近两个月来最大单日涨幅。","2018-09-04 17:59:48","2018-09-04 17:59:54","['市场']"
"1038741","山西省经信委、山西省发改委和国家能源局山西监管办公室9月3日联合发布《关于进一步放开重点行业用电企业参与电力直接交易的通知》，明确将放开煤炭、钢铁、有色、建材四个行业用电企业全电量参与电力直接交易。","2018-09-04 18:02:47","2018-09-04 18:02:47","['行业']"
"1038742","*ST双环晚间公告，公司与湖南盐业签署股权转让意向协议，协议约定由湖南盐业收购公司持有的重庆宜化100%股权。如协议约定最终完成，重庆宜化将不再成为公司合并报表范围内的子公司，预计将对公司合并报表的营业收入、利润、资产负债构成等造成重大影响。","2018-09-04 18:07:12","2018-09-04 18:07:18","['公司', 'A股']"
"1038743","加泰罗尼亚2020年2月到期的债券收益率跌至历史新低1.058%，此前有报道称西班牙首相提出就加泰罗尼亚是否应获得更大的自治权进行公投。","2018-09-04 18:15:28","2018-09-04 18:15:28","['宏观']"
"1038744","黄炜将去国家粮食与物资储备局赴任，任职副局长；张慎峰则赴任中国国际贸易促进委员会，任职副会长。这是证监会落实“三定”后，对人员编制的重新调整，此后证监会将固定为“一正四副”的部委常规配置。（券商中国）","2018-09-04 18:21:59","2018-09-04 18:22:06","['宏观']"
"1038745","瑞信股票策略师Golub称，标普500指数料将在2019年升至3350点。（彭博）","2018-09-04 18:24:36","2018-09-04 18:24:36","['市场', '观点']"
"1038746","记者获悉，猎豹移动私有化的主导方有可能为同属“雷军系”旗下的小米集团，通过收购整合猎豹移动（CMCM）成为一家真正的互联网企业，业务上可形成较大的协同效应。（证券时报）","2018-09-04 18:31:14","2018-09-04 18:31:19","['公司', '焦点']"
"1038747","长盈精密晚间公告，公司计划进行股份回购，金额不超过2亿元且不低于3000万元，回购股份的价格不超过16元/股。回购的股份计划用于实施员工持股计划或股权激励计划。","2018-09-04 18:33:10","2018-09-04 18:33:15","['公司', 'A股']"
"1038748","三方达成一致，预计2018-2022年，亚行将会同其他发展伙伴筹集总额达60亿美元的一揽子支持，用于支持中方实施乡村振兴战略。中方将充分利用亚洲开发银行的资金和智力支持，通过实施一批高质量的亚洲开发银行贷款项目以及国别和区域知识合作技术援助项目，与亚洲开发银行共同推进中国农村人居环境整治、农业生产现代化、农村产业融合发展示范园建设、农村公共服务改善、城乡融合发展等乡村振兴重点领域的发展。","2018-09-04 18:34:35","2018-09-04 18:34:42","['宏观', '行业']"
"1038749","近期，沈阳等多地相继暴发非洲猪瘟疫情。记者4日从广东省农业厅获悉，广东积极开展非洲猪瘟疫情防控，截至9月2日，全省共出动10.97万人次，排查场点14.35万个次，排查生猪5097.46万头次，均未发现异常。（中国新闻网）","2018-09-04 18:34:55","2018-09-04 18:35:00","['行业']"
"1038750","欧洲央行管委、立陶宛央行行长Vasiliauskas呼吁对欧盟所有系统重要性银行采取中央化监管方式，而不论其东道国是哪个国家。","2018-09-04 18:36:38","2018-09-04 18:36:38","['宏观', '观点']"
"1038751","河北省环保厅科技处副处长李红彦说，为实现白洋淀水质达到《河北雄安新区规划纲要》提出的Ⅲ—Ⅳ类水体的目标，河北制定了《大清河流域水污染物排放标准》，将这个流域划分为核心控制区、重点控制区、一般控制区。其中，核心控制区就是雄安新区全域，包括雄县、容城、安新三县行政辖区（含白洋淀水域），任丘市鄚州镇、苟各庄镇、七间房乡和高阳县龙化乡。（雄安发布）","2018-09-04 18:38:38","2018-09-04 18:38:44","['宏观']"
"1038752","欧洲央行管委、芬兰央行行长Rehn：为防止出现银行挤兑，需建立共同的银行存款担保项目。","2018-09-04 18:40:13","2018-09-04 18:40:20","['宏观', '观点']"
"1038753","从本月起，包括中国在内的百余个国家地区的税务主管当局将互相交换跨境账户信息。这意味着，中国国家税务总局将清楚掌握我国居民在上百国家地区开设银行账户情况。这一行动是全球百余国家地区围绕一项名为CRS的共同协议进行的。（北京青年报）","2018-09-04 18:44:13","2018-09-04 18:44:21","['宏观', '焦点']"
"1038754","记者获悉，近日，医疗大数据公司柯林布瑞(ClinBrain)宣布于上半年完成6800万元A轮融资，本轮投资由正海资本和瑞健资本联合领投，京颐股份、广润资本、华方资本跟投。","2018-09-04 18:44:46","2018-09-04 18:44:53","['公司']"
"1038755","记者获悉，近日，中国移动首次完成电信级CloudOS与商用SDN系统，即中国移动电信云操作系统CloudOS与中兴通讯ZENIC SDN控制器的解耦及对接测试。中兴通讯助力中国移动在NFV部署中成功引入SDN组网，加速推进中国移动核心网三层解耦及NFV化进程，推动NFV与SDN接口标准化发展，为中国移动面向未来的5G网络搭建更具弹性的新型基础设施平台。","2018-09-04 18:45:07","2018-09-04 18:45:07","['公司']"
"1038756","中恒电气晚间公告，公司拟回购股份，将用于公司实施股权激励或注销等。回购股份的资金总额不低于5000万元，价格不超过15元/股。","2018-09-04 18:45:55","2018-09-04 18:46:01","['公司', 'A股']"
"1038757","花旗：将京东纳入负面观察清单中。","2018-09-04 18:46:13","2018-09-04 18:46:13","['公司', '焦点']"
"1038758","卓翼科技拟在武汉建设智能终端研发制造基地，项目总投资50亿元。","2018-09-04 18:47:15","2018-09-04 18:47:24","['公司', 'A股']"
"1038759","9月4日起，乘客端原“紧急求助”功能升级为“一键报警”； 9月13日起，司机端上线“一键报警”功能。滴滴出行将于2018年9月8日23点至9月15日凌晨5点期间在中国大陆地区暂停提供深夜23:00-5:00时间段的出租车、快车、优步、优享、拼车、专车、豪华车服务。","2018-09-04 18:47:46","2018-09-04 18:47:51","['公司', '焦点']"
"1038760","纽约白银期货日内跌幅达2%，报14.27美元/盎司。","2018-09-04 18:50:42","2018-09-04 18:50:47","['市场']"
"1038761","晶瑞股份：持股2.7705%股东尤家栋拟6个月内减持不超过1.9865%。","2018-09-04 18:51:06","2018-09-04 18:51:15","['公司', 'A股']"
"1038762","天邦股份公告称，8月份销售商品猪19.06万头，销售收入2.7亿元，销售均价13.67元/公斤（剔除仔猪价格影响后为13.51元/公斤），环比变动分别为4.57% 、11.31%、11.35%。1-8月销售商品猪127.07万头，销售收入17.16亿元，销售均价11.78元/公斤（剔除仔猪价格影响后为11.7元/公斤），同比变动分别为108.93%、72.08%、-22.30%。","2018-09-04 18:54:51","2018-09-04 18:54:57","['公司', 'A股']"
"1038763","睿见教育9月4日晚间公告，截至9月1日，集团入学总人数为51520人，去年同期为41180人，同比增长25.1%。集团预计随着2018/2019学年第二学期插班入学人数增加，入学总人数也会进一步增加。另外，集团于2018/2019学年增加若干学校新入学学生的学费及住宿费。根据目前可得的资料，集团预计截至2019年8月31日止财政年度学费及住宿费收入的增幅百分比将高于25.1%。","2018-09-04 18:55:16","2018-09-04 18:55:23","['公司']"
"1038764","移动通信公司MTN称，尼日利亚寻求该公司补缴税款20亿美元。","2018-09-04 18:56:31","2018-09-04 18:56:31","['公司']"
"1038765","扬杰科技9月4日晚间公告，持公司2.33%股权的股东王艳计划六个月内减持公司股份不超过944.53万股，占公司总股本2%。","2018-09-04 18:58:10","2018-09-04 18:58:16","['公司', 'A股']"
"1038766","水晶光电9月4日晚间公告，公司因生产所需，拟向公司之参股公司日本光驰购买镀膜设备，交易总金额约合人民币2585.18万元。本次购买镀膜设备，有利于公司实现产能扩张，对公司未来经营业绩会产生积极影响。","2018-09-04 18:58:52","2018-09-04 18:58:58","['公司', 'A股']"
"1038767","3日，中国机械工业集团有限公司外部董事张来亮、吴晓根、高福来、盛世英及董事会秘书孙淼一行赴中国恒天集团有限公司调研。国机集团外部董事对恒天集团进一步深化改革发展提出了指导意见和建议：不断深化与国机集团的业务协同和优势互补，根据国资委“双百行动”的动员部署稳步推进混合所有制改革；切实解决好恒天集团长远发展和短期效益的问题，努力提升主业盈利水平，主动加强风险防范措施，确保全年各项经营指标的圆满完成。","2018-09-04 18:59:07","2018-09-04 18:59:14","['公司']"
"1038768","吉艾科技9月4日晚间公告，公司于2016年底成立了全资子公司开展不良资产的管理服务、重整服务及清收处置等相关业务。2017年度，公司AMC板块收入已超过公司营业收入总额的50%，因此需相应变更公司行业类别。公司所属行业由仪器仪表制造业，变更为资本市场服务。","2018-09-04 19:00:20","2018-09-04 19:00:28","['公司', 'A股']"
"1038769","中航三鑫9月4日晚间公告，子公司三鑫科技为深圳市宝安区老虎坑垃圾焚烧发电厂三期项目幕墙工程的中标人，中标价格2.24亿元，占公司2017年度经审计营业收入的4.86%。","2018-09-04 19:01:14","2018-09-04 19:01:21","['公司', 'A股']"
"1038770","中共中央对外联络部新闻发言人4日在北京宣布，应朝鲜劳动党中央委员会和朝鲜民主主义人民共和国政府邀请，中共中央政治局常委、全国人大常委会委员长栗战书作为习近平总书记、国家主席的特别代表将率中国党政代表团于9月8日访问朝鲜，并出席朝鲜建国70周年庆祝活动。（新华视点）","2018-09-04 19:02:11","2018-09-04 19:03:38","['宏观', '焦点']"
"1038771","投行人士向一财透露，美团之所以披露到截至4月30日的财务数据，是因为跟收购摩拜的情况有关，4月才开始让两者的财务报表合并，这也符合9月完成上市的要求。（一财）","2018-09-04 19:05:25","2018-09-04 19:05:30","['公司']"
"1038772","9月4日，记者从浙江省工业互联网发展情况新闻发布会获悉，近日印发的《浙江省人民政府关于加快发展工业互联网促进制造业高质量发展的实施意见》，计划到2020年，浙江将培育形成1个具有国际水准的基础性工业互联网平台和10个以上国内领先的行业级工业互联网平台，开发集成3万款以上工业应用程序(APP)，服务10万家以上工业企业。","2018-09-04 19:06:27","2018-09-04 19:06:27","['宏观']"
"1038773","神雾节能：合计持股6.04%的一致人文菁华、曹雅群及张寿清拟3个月内减持不超过3%。","2018-09-04 19:06:59","2018-09-04 19:07:04","['公司', 'A股']"
"1038774","证监会消息，近日，由青岛证监局与青岛市国土资源和房屋管理局共同主办的青岛辖区住房租赁资产证券化业务培训会，在青岛市资本市场服务基地召开。下一步，青岛证监局将继续支持辖区专业化、机构化住房租赁企业发展，推动企业发行住房租赁资产证券化产品尽早落地，并积极呼吁政府相关部门出台支持政策，助力青岛住房租赁市场发展。","2018-09-04 19:08:49","2018-09-04 19:08:55","['宏观']"
"1038775","中国联通澄清“与中国电信存在合并可能”的相关报道：截至本公告日，公司及联通集团不了解媒体上述报道相关情况，且未接获任何政府部门与上述报道内容相关的通知。","2018-09-04 19:09:39","2018-09-04 19:09:45","['公司', '焦点']"
"1038777","和顺电气9月4日晚间公告，为满足全资子公司苏州和顺能源正常经营发展的资金需求，扩大经营规模，公司拟对和顺能源增资4000万元。完成后，和顺能源注册资本由4000万元增加至8000万元，和顺能源仍为公司全资子公司。","2018-09-04 19:13:47","2018-09-04 19:13:53","['公司', 'A股']"
"1038778","奥特佳9月4日晚间公告，公司决定转让控股子公司金飞利、金飞祥、金飞盈和金飞达75%股权，以及金飞达（毛里求斯）有限公司100%股权，受让方为南通市通州泽成服装辅料有限公司，上述股权的转让价格为1.88亿元。公司本次出售服装业务资产因其盈利能力将会进一步下降。剥离服装业务有利于公司将资源集中到汽车空调压缩机、空调系统及汽车热管理综合技术创新上。","2018-09-04 19:16:37","2018-09-04 19:16:42","['公司', 'A股']"
"1038779","记者获悉，9月4日上午，香港交易所与重庆市人民政府在香港签署合作备忘录，以加强长效沟通合作机制，促进双方在资本市场领域的合作，冀借助香港资本市场进一步更好地服务重庆实体经济的发展。","2018-09-04 19:17:37","2018-09-04 19:17:44","['宏观']"
"1038780","消息人士称，一些仓储公司希望伦敦金属交易所（LME）改变交货规则，允许提货队列变长，以提振因库存下滑而受损的营收。（路透）","2018-09-04 19:18:28","2018-09-04 19:18:36","['宏观']"
"1038781","香港交易所数据显示，8月北向沪股通及深股通净流入为354.53亿元，比上月增长24.5%，沪股通及深股通成交总额为4621亿元，较上月上升12%。沪股通北上资金前三大成交股分别为贵州茅台、中国平安和恒瑞医药，深股通北上资金前三大成交股分别为美的集团、海康威视及格力电器。","2018-09-04 19:19:32","2018-09-04 19:19:36","['市场']"
"1038782","豫金刚石9月4日晚间公告，控股股东河南华晶拟向农投金控转让其持有的公司1.01亿股股份，占总股本8.42%，每股转让价格为4.598元。完成后，河南华晶与一致行动人郭留希合计持有公司27.41%股权。本次股权转让，将为公司引进新的战略投资者，有利于帮助公司在超硬材料行业做大做强。","2018-09-04 19:21:13","2018-09-04 19:21:21","['公司', 'A股']"
"1038783","金禾实业9月4日晚间公告，近日，全资子公司金轩科技收到滁州市环境保护局的批复，原则同意“金禾实业循环经济产业园一期项目”按照相关要求进行建设。金轩科技将加快项目建设进度，争取早日投产。上述项目投产后，将对公司的经营业绩产生积极影响。","2018-09-04 19:22:10","2018-09-04 19:22:10","['公司', 'A股']"
"1038784","中手游科技集团有限公司（下称“中手游”）今日晚间向香港联交所正式递交主板上市申请。招股书显示，中手游2018年上半年持续经营业务收入为6.725亿元，同比增长15.95%；持续经营业务损益为1.627亿元。","2018-09-04 19:25:54","2018-09-04 19:25:58","['公司']"
"1038785","记者获悉，9月4日，科大讯飞与安徽省铜陵市达成战略合作。双方将在“数字铜陵”顶层规划、城市超脑、教育、医疗、政法等领域精细合作，打造看得见、摸得着、有实效的应用。","2018-09-04 19:27:50","2018-09-04 19:27:57","['公司', 'A股']"
"1038786","中债金融估值中心：今日利率债市场整体小幅波动。具体来看，SKY_3M上行1BP至2.14%；SKY_10Y上行2BP至3.61%。","2018-09-04 19:28:26","2018-09-04 19:28:32","['市场']"
"1038787","国星光电9月4日晚间公告，拟出售全资子公司新野国星100%股权。公司将聘请相关中介机构对新野国星资产状况展开审计及评估，通过公开挂牌的方式转让股权。公司表示，本次出售股权有利于公司优化战略区域布局。","2018-09-04 19:29:51","2018-09-04 19:29:57","['公司', 'A股']"
"1038788","9月3日，国家税务总局广州市税务局以天河区税务局科韵路办税大厅为试点，正式启用“刷脸取号”业务。“刷脸取号”应用了佳都科技的人脸识别技术和商用人脸产品，预约办税的人员在不携带身份证的情况下，也能够通过“刷脸”获取预约号，这标志着广州税局开启了互联网+人脸的新服务模式。","2018-09-04 19:31:03","2018-09-04 19:31:10","['公司', 'A股']"
"1038789","澳洲联储主席洛威：澳大利亚经济正在向正确的方向前进；澳元持续贬值将改善就业和CPI前景。","2018-09-04 19:31:31","2018-09-04 19:31:38","['宏观']"
"1038790","富瀚微9月4日晚间公告，持有公司3.89%股权的股东何辉，计划6个月内减持不超过公司股份83.31万股（即不超过公司总股本的1.84%）。","2018-09-04 19:32:05","2018-09-04 19:32:11","['公司', 'A股']"
"1038791","爱司凯9月4日晚间公告，持有公司3.31%股权的股东柏智方德，计划十五个交易日后的三个月内，减持不超过公司股份144万股(即不超过公司总股本的1%)。","2018-09-04 19:32:49","2018-09-04 19:32:49","['公司', 'A股']"
"1038792","消息人士透露，印度允许国有炼厂进口由伊朗政府安排油轮和保险的伊朗石油，此前印度最大的航运公司–印度国家航运公司等企业因美国制裁而暂停至伊朗的航线。","2018-09-04 19:35:41","2018-09-04 19:35:48","['宏观']"
"1038793","  今天《新闻联播》的主要内容有：1、中非合作论坛北京峰会举行圆桌会议，习近平主持通过北京宣言和北京行动计划。2、国家主席特别代表栗战书将访问朝鲜。3、中非领导人与工商界代表高层对话会暨第六届中非企业家大会举行多场专题研讨会。4、国家重大海上溢油应急处置演习今开展。5、俄土伊峰会召开在即，聚焦叙利亚反恐。","2018-09-04 19:37:02","2018-09-04 19:37:02","['宏观', '焦点']"
"1038794","德意志银行将被剔除出Eurostoxx 50指数。（路透）","2018-09-04 19:39:02","2018-09-04 19:39:09","['公司']"
"1038795","华谊嘉信晚间公告，因近期股票交易异常波动，导致公司股东上海寰信股票质押业务的担保物价值与其所欠债务的比例低于约定的维持担保比例，因上海寰信没在约定的期限内补足担保物，中信证券对上海寰信持有的华谊嘉信部分股份进行强制平仓，数量为4.85万股。公司董事李凌波、财务总监兼副总经理柴健、副总经理方华分别持有上海寰信33.4%、33.3%、33.3%股权。","2018-09-04 19:42:55","2018-09-04 19:42:55","['公司', 'A股']"
"1038796","据铃木周二发布的新闻稿，待法律程序完成，铃木将把其最后一家在华合资企业长安铃木50%的股权转让给长安汽车。依据协议，长安汽车将继续在中国生产和销售铃木品牌的汽车。","2018-09-04 19:46:06","2018-09-04 19:46:12","['公司']"
"1038797","  万华化学晚间公告，公司于近日收到山东省发改委批复，同意实施公司聚氨酯产业链一体化——乙烯项目。项目建成投产后，年产100万吨乙烯以及丙烯、混合C4、C6+等中间产物，并深加工生产40万吨聚氯乙烯、15万吨环氧乙烷、45万吨LLDPE、30万吨环氧丙烷和65万吨苯乙烯、5万吨丁二烯等下游产品。项目建设期2年。项目总投资168.04亿元。","2018-09-04 19:46:50","2018-09-04 19:46:54","['公司', 'A股']"
"1038798","美联储BULLARD：我的大多数同事都认为9月份有较高的加息可能性。","2018-09-04 19:47:40","2018-09-04 19:47:47","['宏观']"
"1038799","紫光股份：实控人清华控股向高铁新城、海南联合分别转让所持30%、6%紫光集团股份，对紫光集团实施共同控制，公司实控人将发生变更。","2018-09-04 19:52:04","2018-09-04 19:52:12","['公司', '焦点', 'A股']"
"1038800","爱康科技晚间公告，拟通过发行股份的方式购买鑫成泰100%股权，交易作价为不超过3.9亿元。交易对方承诺，鑫成泰2018-2020年净利润分别不低于3600万元、4000万元和4600万元。鑫成泰专业从事锂电池自动化生产设备的研发、设计、制造、销售与服务。公司表示，本次交易有利于完善在新能源行业尤其是锂电池及新能源汽车行业的布局。","2018-09-04 19:52:33","2018-09-04 19:52:40","['公司', 'A股']"
"1038801","土耳其国防部长Akar与美国官员James Jeffrey会面。","2018-09-04 19:53:30","2018-09-04 19:53:30","['宏观']"
"1038802","美国圣路易斯联储主席Bullard（2019年有投票权）：关于利率，我们处在我们需要在的水平上。特朗普对美联储的影响更多在人事任命方面，而非推特。我的大部分同事都预计9月加息的概率很高。（福克斯商业）","2018-09-04 19:54:17","2018-09-04 19:54:23","['宏观']"
